{
  "title": "非洲大草原生態系統 (Canvas 2D)",
  "type": "iframe",
  "runtime": "canvas",
  "prompt": "# Technical Challenge: Advanced 2D African Savannah Ecosystem with Dynamic Wildlife\n\n## 1) 題目目標\n請使用**原生 HTML + JavaScript + CSS**，在單一頁面打造一個豐富、視覺吸引力的 2D 非洲大草原生態系統動畫。\n\n本題重點在評估你對：\n- 複雜的物件導向設計（OOP / 多模組化系統）\n- 多粒子系統與物理行為的並行管理\n- 狀態機與事件驅動的互動設計\n- 長時間運行效能與記憶體管理的掌握程度\n- **美術表現力**（色彩運用、動畫細節、整體視覺吸引力）\n\n---\n\n## 2) 技術限制（Constraints）\n- **核心技術**：HTML5、CSS3、ES6+ JavaScript\n- **禁止使用**：任何框架、遊戲引擎、外部函式庫\n- **渲染方式**：必須使用 Canvas 2D API\n- **執行方式**：可直接開啟 index.html 或使用簡單 static server\n- **不得依賴後端**\n\n---\n\n## 3) 視覺素材說明（重要）\n- **美術表現將列入評分**：色彩搭配、動物造型細節、環境氛圍、動畫流暢度與整體視覺美感都會被評價\n- 動物與粒子皆可用簡單色塊、線條、基本圖形或自訂路徑繪製\n- 可使用開源 Sprite（需在 README 註明來源）\n- 評估重點為：**系統架構、動畫穩定性、動物行為真實性 與 美術吸引力**\n\n---\n\n## 4) 功能需求\n\n### A. 角色系統（Wildlife）\n- 畫面上同時存在 **至少 6 隻動物**（獅子、大象、豹各至少 2 隻）\n- 每種動物需依照**真實非洲大草原生活習性**活動：\n  - **獅子**：群體移動、偶爾短暫休息或慢速巡邏，速度較慢\n  - **大象**：成群緩慢移動、偶爾「喝水」或抬鼻動作，體型較大\n  - **豹**：單獨、快速且隱密移動，偶爾「攀爬」樹木（簡單垂直動畫）\n- 所有動物皆由左側進入畫面，抵達右側後從左側重新出現（無縫循環）\n- 不同天氣與季節下，動物行為會明顯改變（速度、群聚、動作頻率等）\n\n### B. 天氣與季節系統（Weather + Season Ecosystem）\n頁面下方提供 **天氣按鈕**（單選） + **季節切換**：\n- 天氣：Sunny、Rain、Heavy Rain、Snow、Thunderstorm、Tornado（共 6 種）\n- **季節**：乾季（Dry Season）與濕季（Wet Season），每 **60 秒** 自動輪轉一次（或可手動切換），並影響：\n  - 背景顏色、草地色調、整體亮度\n  - 天氣可用性（例如雪只在乾季較少出現）\n  - 動物行為（濕季動物更活躍、乾季更趨向群聚）\n\n**進階要求**：\n- 天氣切換時舊粒子必須正確清理或回收\n- 部分天氣產生次要效果（雨天地面積水、龍捲風捲起粒子）\n- 閃電**不可擊中任何動物**，必須根據所有動物即時位置動態計算安全區\n- 龍捲風需具備追逐行為（朝最近的動物靠近，但速度較慢）\n\n### C. 互動與狀態規則\n- 同一時間只有一種主要天氣 + 當前季節\n- 切換天氣或季節時動物**不可停止或重置位置**\n- 建議加入視差多層背景（天空、遠山、草原）以增加深度與美術效果\n\n---\n\n## 5) 程式品質要求（Code Quality）\n- 必須使用 `requestAnimationFrame` + `deltaTime`\n- 展現清晰模組化設計（例如 `Lion`、`Elephant`、`Leopard`、`WeatherManager`、`SeasonManager`、`ParticleSystem` 等類別）\n- **必須實作 Object Pooling** 管理大量粒子\n- 關鍵演算法（閃電安全區、龍捲風追逐、季節過渡）需加上註解\n- 長時間運行（切換多次、30 分鐘以上）不得出現明顯卡頓或記憶體洩漏\n\n---\n\n## 6) 交付內容（Deliverables）\n1. 程式碼：\n   - `index.html`\n   - `style.css`\n   - `main.js`（可拆分多檔）\n2. `README.md`（必填）：\n   - 如何啟動\n   - 為何選擇 Canvas\n   - 粒子管理與效能策略\n   - 雷暴安全區演算法說明\n   - 動物習性實作與季節變化邏輯\n   - Object Pooling 實作細節\n\n---\n\n## 7) 驗收標準（Definition of Done）\n- [ ] 至少 6 隻動物（獅子、大象、豹）依照非洲習性正常循環移動\n- [ ] 6 種天氣 + 乾/濕季皆可切換且有明顯視覺與行為差異\n- [ ] 天氣與季節明顯影響動物行為\n- [ ] 閃電永遠不會擊中任何動物\n- [ ] 龍捲風具追逐效果\n- [ ] 使用 Object Pooling 管理粒子\n- [ ] 長時間運行無明顯效能劣化\n- [ ] 美術表現具有吸引力（色彩、動畫細節）\n- [ ] 程式碼具良好模組化與可讀性\n- [ ] README 完整說明核心設計\n\n---\n\n## 8) 加分項目（Bonus）\n- 視差多層背景 + 動態雲層與草地動畫\n- 天氣與季節切換時的平滑過渡效果\n- 動物簡單「心情」或狀態顯示\n- 顯示 FPS / 粒子數 debug overlay\n- 支援鍵盤快捷鍵切換天氣與季節\n- RWD（視窗調整大小時畫面自動適配）",
  "description": "進階 Canvas 2D 挑戰：評比 OOP 架構、粒子 Object Pooling、狀態機與美術表現。6+ 動物依非洲習性循環、6 種天氣 × 乾濕季、閃電避開動物、龍捲風追逐。",
  "order": 30
}
