{
  "title": "漂浮倫敦島與四季天氣 (Three.js)",
  "type": "iframe",
  "runtime": "webgl",
  "prompt": "# Technical Challenge: 3D Cartoon Floating London Island with Four Seasons Weather\n## 1) 題目目標\n請使用**原生 HTML + Three.js + CSS**，在單一頁面實作一個卡通風格且視覺吸引力的 3D 動畫場景。\n本題重點在評估你對：\n * Three.js 場景管理與渲染管線\n * 粒子系統（天氣變化）與大量物件的效能控制\n * 光影、時間驅動的動畫狀態與氣候過渡\n * 3D 互動與相機控制\n * 整體程式架構與長時間運行穩定性\n * **美術表現力**（色彩運用、光影氛圍、整體視覺吸引力）\n## 2) 技術限制（Constraints）\n * **核心技術**：HTML5、CSS3、Three.js（v134 或更新版本，可透過 CDN 引入）\n * **禁止使用**：任何其他 3D 框架、遊戲引擎、React/Vue 等\n * **渲染方式**：必須使用 Three.js WebGLRenderer\n * **執行方式**：可直接開啟 index.html 或使用簡單 static server\n * **不得依賴後端**\n## 3) 視覺素材說明（重要）\n * **美術表現將列入評分**：色彩搭配、光影使用、材質細節、氣候氛圍與卡通風格的呈現都會被評價\n * 所有物件皆可用基本幾何體（BoxGeometry、CylinderGeometry、PlaneGeometry 等）組合\n * 天氣粒子（如楓葉、雪花）可用簡單平面 + 顏色或自訂材質\n * 推薦使用 MeshStandardMaterial / MeshToonMaterial 達成卡通風格\n * 若使用外部紋理，請在 README 註明來源\n## 4) 功能需求\n### A. 主場景\n * 一個漂浮在空中的卡通風格小島（島體需有輕微上下浮動動畫）\n * 島中央為**大笨鐘 (Big Ben)**（可用簡單幾何體搭建）\n * 周圍散落倫敦特色簡化景點，必須包含**倫敦眼 (London Eye)** 與**倫敦塔橋 (Tower Bridge)**\n * 需具備動態的**四季天氣系統**（詳見下節）\n### B. 四季氣候與日夜循環系統\n * **四季天氣循環**：模擬倫敦氣候特徵，場景需平滑切換四季：\n   * **春季 (Spring)**：濕潤多霧 (Humidity)，場景帶有明顯的水氣感與輕柔晨霧\n   * **夏季 (Summer)**：炎熱晴朗 (Hot)，光照強烈、色彩溫暖飽滿\n   * **秋季 (Autumn)**：大量楓葉在空中自然飄落（需有旋轉與左右擺動）\n   * **冬季 (Winter)**：寒冷氣氛，大量雪花飄落\n * **日夜循環**：每 **15 秒** 進行一次完整日夜輪轉（白天 → 黃昏 → 夜晚 → 黎明 → 白天）\n * 必須自然平滑過渡（天空顏色、環境光、定向光、霧氣等都要漸變）\n * 黃昏開始時，大笨鐘、倫敦眼與塔橋自動亮燈（PointLight 或材質自發光）\n * 黎明前燈光自動關閉\n * 太陽與月亮位置需隨時間變化\n### C. 互動功能\n * 使用滑鼠**左右拖曳**可旋轉視角（OrbitControls 或自行實作）\n * 拖曳過程中場景必須持續動畫\n## 5) 程式品質要求（Code Quality）\n * 必須使用 requestAnimationFrame + deltaTime\n * 清晰模組化設計（建議包含 Island、BigBen、Landmark、WeatherSystem、DayNightCycle 等類別）\n * 天氣粒子（楓葉/雪花）需使用物件池或有效回收機制\n * 長時間運行（包含氣候與日夜切換）不得出現明顯卡頓或記憶體洩漏\n * 關鍵演算法（日夜與季節過渡、燈光控制、粒子物理）需加上註解\n## 6) 交付內容（Deliverables）\n 1. 程式碼：\n   * index.html\n   * style.css\n   * main.js（可拆分多個 JS 模組）\n 2. README.md（必填）：\n   * 如何啟動\n   * Three.js 版本與引入方式\n   * 日夜循環與四季氣候的時間控制、過渡邏輯說明\n   * 粒子系統與效能優化策略\n   * 相機旋轉控制的實作方式\n## 7) Responsive Embed Requirement\n此作品會在 AI Arena gallery 內以 iframe card 形式嵌入預覽，必須在極小預覽尺寸仍可操作：\n * 目標最小嵌入 viewport：320px × 200px\n * 預覽 aspect ratio：16:10\n * 在此尺寸下仍必須呈現有意義的主要場景內容\n * 主要 controls 必須可見、可點擊/觸控，且不可互相重疊或溢出畫面\n * 文字、HUD、panel 不可佔滿預覽空間或遮住主要內容；小尺寸時可折疊為 icon、drawer、tabs 或精簡 overlay\n * 開新分頁時可提供更完整 UI，但嵌入預覽本身仍必須功能可用\n## 8) 驗收標準（Definition of Done）\n * [ ] 浮空島、大笨鐘、倫敦眼與倫敦塔橋正確呈現並持續動畫\n * [ ] 四季天氣系統（春霧、夏日、秋楓、冬雪）平滑切換，粒子自然飄落且效能穩定\n * [ ] 每 15 秒完成一次自然日夜輪轉（含燈光自動開關）\n * [ ] 支援滑鼠左右拖曳旋轉視角\n * [ ] 長時間運行無明顯效能劣化\n * [ ] 美術表現具有吸引力（色彩、光影、卡通感）\n * [ ] 程式碼具良好模組化與可讀性\n * [ ] 在 320px × 200px、16:10 iframe preview 中，主要 3D 場景仍可見，視角互動/主要 controls 可用，HUD 不重疊、不溢出、不遮住主要內容\n * [ ] README 完整說明核心設計\n## 9) 加分項目（Bonus）\n * 使用 MeshToonMaterial 做出強烈卡通渲染效果\n * 加入簡單雲層，或倫敦泰晤士河的微波水面效果\n * 支援 UI 面板或鍵盤快捷鍵，可手動快速切換季節與日夜\n * 顯示粒子數 / FPS debug 資訊\n * RWD（視窗 resize 自動調整畫面比例）\n * 加入依日夜或氣候變化的背景音效（Web Audio API）",
  "description": "卡通風 3D 進階挑戰：浮空倫敦島 + 大笨鐘 + 倫敦眼 + 塔橋，四季天氣（春霧、夏日、秋楓、冬雪）平滑過渡、15 秒日夜輪轉與自動亮燈、滑鼠旋轉視角。評比場景管理、粒子效能與美術氛圍。",
  "order": 50
}
