{
  "title": "漂浮東京島與楓葉 (Three.js)",
  "type": "iframe",
  "runtime": "webgl",
  "prompt": "# Technical Challenge: 3D Cartoon Floating Tokyo Island with Maple Leaves\n\n## 1) 題目目標\n請使用**原生 HTML + Three.js + CSS**，在單一頁面實作一個卡通風格且視覺吸引力的 3D 動畫場景。\n\n本題重點在評估你對：\n- Three.js 場景管理與渲染管線\n- 粒子系統與大量物件的效能控制\n- 光影與時間驅動的動畫狀態\n- 3D 互動與相機控制\n- 整體程式架構與長時間運行穩定性\n- **美術表現力**（色彩運用、光影氛圍、整體視覺吸引力）\n\n---\n\n## 2) 技術限制（Constraints）\n- **核心技術**：HTML5、CSS3、Three.js（v134 或更新版本，可透過 CDN 引入）\n- **禁止使用**：任何其他 3D 框架、遊戲引擎、React/Vue 等\n- **渲染方式**：必須使用 Three.js WebGLRenderer\n- **執行方式**：可直接開啟 index.html 或使用簡單 static server\n- **不得依賴後端**\n\n---\n\n## 3) 視覺素材說明（重要）\n- **美術表現將列入評分**：色彩搭配、光影使用、材質細節、整體氛圍與卡通風格的呈現都會被評價\n- 所有物件皆可用基本幾何體（BoxGeometry、CylinderGeometry、PlaneGeometry 等）組合\n- 楓葉可用簡單平面 + 顏色或自訂材質\n- 推薦使用 MeshStandardMaterial / MeshToonMaterial 達成卡通風格\n- 若使用外部紋理，請在 README 註明來源\n\n---\n\n## 4) 功能需求\n\n### A. 主場景\n- 一個漂浮在空中的卡通風格小島（島體需有輕微上下浮動動畫）\n- 島中央為東京鐵塔（可用簡單幾何體搭建）\n- 周圍散落至少兩個日本特色簡化景點（例如富士山、鳥居、寺廟等）\n- 大量楓葉在空中自然飄落（需有旋轉與左右擺動）\n\n### B. 日夜循環系統\n- 每 **15 秒** 進行一次完整日夜輪轉（白天 → 黃昏 → 夜晚 → 黎明 → 白天）\n- 必須自然平滑過渡（天空顏色、環境光、定向光、霧氣等都要漸變）\n- 黃昏開始時，東京鐵塔與周圍景點自動亮燈（PointLight 或材質自發光）\n- 黎明前燈光自動關閉\n- 太陽與月亮位置需隨時間變化\n\n### C. 互動功能\n- 使用滑鼠**左右拖曳**可旋轉視角（OrbitControls 或自行實作）\n- 拖曳過程中場景必須持續動畫\n\n---\n\n## 5) 程式品質要求（Code Quality）\n- 必須使用 `requestAnimationFrame` + `deltaTime`\n- 清晰模組化設計（建議包含 `Island`、`TokyoTower`、`Landmark`、`MapleLeafSystem`、`DayNightCycle` 等類別）\n- 楓葉需使用物件池或有效回收機制\n- 長時間運行不得出現明顯卡頓或記憶體洩漏\n- 關鍵演算法（日夜過渡、燈光控制、粒子物理）需加上註解\n\n---\n\n## 6) 交付內容（Deliverables）\n1. 程式碼：\n   - `index.html`\n   - `style.css`\n   - `main.js`（可拆分多個 JS 模組）\n2. `README.md`（必填）：\n   - 如何啟動\n   - Three.js 版本與引入方式\n   - 日夜循環的時間控制與過渡邏輯說明\n   - 粒子系統與效能優化策略\n   - 相機旋轉控制的實作方式\n\n---\n\n## 7) 驗收標準（Definition of Done）\n- [ ] 浮空島、東京鐵塔與至少兩個日本特色景點正確呈現並持續動畫\n- [ ] 楓葉粒子系統自然飄落且效能穩定\n- [ ] 每 15 秒完成一次自然日夜輪轉（含燈光自動開關）\n- [ ] 支援滑鼠左右拖曳旋轉視角\n- [ ] 長時間運行無明顯效能劣化\n- [ ] 美術表現具有吸引力（色彩、光影、卡通感）\n- [ ] 程式碼具良好模組化與可讀性\n- [ ] README 完整說明核心設計\n\n---\n\n## 8) 加分項目（Bonus）\n- 使用 MeshToonMaterial 做出強烈卡通渲染效果\n- 加入簡單雲層或遠景山脈\n- 支援鍵盤快捷鍵加速日夜循環\n- 顯示粒子數 / FPS debug 資訊\n- RWD（視窗 resize 自動調整畫面比例）\n- 加入依日夜變化的背景音效（Web Audio API）",
  "description": "卡通風 3D 挑戰：評比 Three.js 場景/渲染管線、粒子效能、日夜循環與美術氛圍。浮空島 + 東京鐵塔 + 日本景點、楓葉飄落、15 秒日夜輪轉、滑鼠旋轉視角。",
  "order": 40
}
